Comments,Ratings
"Very nice view from the top floor, amazing pool and very nice atmosphere. Enjoy breakfast near the most amazing pool, but it better to come earlier as many people want to do this at the same time;) however the hotel is rather noisy and never sleeps and maybe you can be tired of lots of people around you. Also You should spend 20 minutes in big Q. for check in and check out.",4
"We had been dreaming about staying at the Marina Bay Sands Hotel in Singapore for many years but never could justify the expense. However, for a special big 50th birthday, we decided to blow the budget, and tick off one of the things on our bucket list.  Transfer from Changi Singapore Airport - Marina Bay Sands Hotel will provide a Limousine transfer, however, the cheapest rate at this time $120 (£60). Tip – Get a normal taxi from the airport, this is very easy to do. We followed the Taxi signs just outside the arrivals hall and found it easily, we jumped in a taxi, paid $24 (£12) and arrived at the hotel 20 minutes later. Checking in - We had booked a Grand Club Room so were able to check in at the Club desk. This was situated in Tower one and easy to find. The service was…",5
"Located at Marina Bay, you could access the hotel and nearby sites by MRT (Bayfront Station)  High en shops, restaurants from local to international, world-class casino, luxe hotel. Name it, MBS has almost all the classy travellers/shoppers (not me :-) ) ever wanted.",4
"I must say that if u go Singapore than without visiting marina bay sands your trip is incomplete. It is such a lovely property for all aspects shopping, hospitality, food even Indian food is amazing , rooms are very spacious, casino is there n last but not d least THE INFINITY POOL. Aahhhh it is just a big WOWWWW! One can see whole Singapore from there. As I was with my baby they provided baby cot n baby amenity kit which was of excellent quality of pigeon brand. And location of the property is also amazing. Even it has the most beautiful gardens by the bay. Worth going I must say.",5
"Pool was amazing as all the pictures show, but there were some let downs. The non-smoking room smelled of smoke so we had to change rooms, and most of the food was overprice for the quality of food. The restaurant Ku De Ta was pricey for the mediocre quality of food - have had much better in other cities.  Although there were some great ups to the trip - very good location to the shopping area and Marina Singapore.  Service was sometimes slow and especially ordering things (ie. pillows/sheets) to the room took over an hour, but I guess you would expect that from such a large hotel.",4
"Very nice hotel, but honestly quite business-like so did not set me to a vacation mood immediately.   What made our stay was our decision to book a club room with complimentary breakfast, afternoon tea and evening drinks. View from the club is amazing, service excellent.   Infinity pool is worth a visit and taking those Instagram photos.",4
"Visited here with my friend  it was a great experience place overlooking the city of singapore ,very nice infinity pool ,have to go early to reserve  so you can join the group tour wish to coming back again ",5
"I'd always wanted to stay here and was so glad that we did. The hotel is mind blowing - huge structure made of 3 towers. As expected, it was very busy and we did feel this took the edge off it a bit. Convenient location and there's an MRT stop below the hotel. This really is a resort destination with a casino, theatre, many restaurants, gardens and even a shopping mall attached to it. We loved exploring and wished we could have stayed for longer!  We took a club room which was a good size with a city view. The only comment about the room would be the quality of the towels which was quite poor considering the price of the room. The rest of the linens and finish to the room was great.  Our club room gave us access to the club lounge on the 55th floor where they serve breakfast and…",4
This is a hotel with the wow factor from th first time you see it till you enter and see the size of the place it is a destination in its own right. Even if you don't stay here it is worth a visit. We arrived and had no issues in booking in with an efficient reception team. Our bags were taken to our room in Tower 3. The hotel is 57 floors high our room was on the 13th on entering we still had a great view out over the Gardens by the Bay to the ocean. The room itself was modern clean and had all the facilities required fridge safe etc. Bathroom good size with a shower over the bath but no issues. We had no problems with the Wi Fi in the room or public areas. As a guest Yo have access to the roof top pool on the Sky deck.  This is a must visit it truly is spectacular with…,5
"Infinity swimming pool on level 57 is just breath taking.. as soon as you get in the pool and look over the edge you will forget everything else..  Apart from swimming pool, bar on lvl 57 and view from your room there is nothing special about this hotel. All other things are over priced. Gardens by the bay and The Shoppes mall is nearby. Mall again is expensive. Food court in The Shoppes is around 10-15 min walk from hotel to buy food/coffee at above decent price. You can't stay there if you want to enjoy real singapore food, streets, culture and people.  Hotel entrance lobby of all three towers is full of tourist during day time who are there to just see the building. This certainly gives you feeling of residing at a public/tourist spot instead of 5 star abode.  Worth paying…",3
"We stayed here just one night in a 12 day trip to surrounding countries. The vista was worth the pricey rooms. The pool attendants provided fabulous customer service. Front desk experience included long lines, friendly, but not informative on hotel layout. This would have been helpful as the property is gigantic. We had the breakfast buffet, also pricey but an amazing selection of authentic and diverse cuisines from local to comfort foods and everything in between. The rooms were very clean and modern with appropriate amenities. All public restrooms were maintained impeccably. The bell staff did not speak English and was therefore not helpful anytime we left. The concierge tried to be helpful, but language again was a bit of an issue. The location was not within walking distance…",5
"This hotel is simply overrated! If you're going to commute, the location is quite a long walk from the nearest mrt. Sure you can get a cab, but pricey! The room we booked might have just been deluxe, but it was really small, and stank of cigarettes! We specifically requested a non-smoking room but was greeted by the smell once we opened the door. We called reception to ask for another room but we were told they were fully booked and just said that they will send room service. We wasted several hours of our precious holiday in the room, waiting for the staff that never came! The staff came when we came back to the hotel, armed with a can of air freshener which didn't do any good of course! With the amount we paid for this hotel, I was very disappointed! It was too crowded,…",1
"The scale of this hotel is jaw-dropping. It can be a little busy at times in the lobby which is slightly off putting but the eating spaces, especially the bar on the roof, are relaxing and tranquil.  The views from the Sky Deck are just breathtaking, as is the infinity pool. This place is a must see if you're visiting Singapore.",4
Stayed 2-nights in a King-Bed City View Premier Room. Was sort of a birthday staycation with the wife over 2 weekdays.   Pros : (1) Rooms were clean.  Most basic requirement and the rooms were kept clean throughout the stay. Refer to photos of the room attached.  (2) Pool was Memorable. Guess one of the biggest reason to stay here and take in the epic view of the Singapore skyline from the pool is a must ! A swim is a must.   (3) The Great View of the Skyline from the Room Again the view of the city from the room was breath taking. Gives you an appreciation of the very varied Singapore Skyline  (4) Staff Service was good This does seem to get very varied reviews. During my stay the service standard of the staff I interacted with was great. We had dinner with the parents one of…,4
One of a kind experience...wish we could go back en savor another extraordinary moment in this precious location 🏙... My kids really had fun staying in our room and even more when we jumped in to the infinity pool on top of the 3 towers. It was breathtaking! Such an architectural en engineering wonder.  ,5
"This hotel is in my view, to big, with to many people. It has 2561 rooms, which are very nice, with good views. However! When you enter the hotel, the volume of people, is just mind blowing. You think it ll quieten down, but it doesn't. There s no peace at all, apart from in your room, the ground floors just like a transit airport, where you are continuously bumping into rude people, to interested in there mobile phones. Facilities are poor on the ground floor, limited toilets, seating away from the bar/restaurants. Staff are nice and fairly efficient, although, a week after we left, there still taking money off our credit card. I ve tried to email them, on this matter, but there mailbox is continuously full, so it won't deliver. The 57 floor pool is great, but it's very…",1
"I had read lots of reviews before staying here for 3 nights and asked myself if it was worth the extra. It really is - the views, pool, service and location are brilliant. There's a fancy shopping mall under the hotel and casino too but the best thing was the tube stop. As it rains a lot of the time in Singapore this made getting around really easy. I would recommend this hotel to anyone.",5
"The Marina Bay Sands is a stunning hotel as you approach with a rooftop pool complex extending across three towers at the 57th floor of each.  Incredible infinity pool and pleasant bars and restaurants on top.  To me, this is the highlight of the hotel.  Overall property is very nice and well located.  If you enjoy walking or running, great access to marina area, gardens and related paths.  Connected to large high-end shopping and casino if this is your thing.  Only down-side is that it is quite expensive (and so have rated it as very good vs. excellent for price/value consideration) and if for more budget conscious there are other great properties in Singapore.   If cost is not an issue then highly recommended especially if you may have time to enjoy the rooftop amenities.",4
"A holiday at this hotel was on my bucket list; I couldn't wait to stay there. The design is amazing and I couldn't wait to laze by the incredible infinity pool. We stayed for four nights in December as a family of four. Two nights would have been plenty. My best description of the hotel and our experience, was that it felt like we stayed for four nights in a shopping mall.  Beside the pool level, which is always extremely busy and the Club lounge, there really isn't really anywhere that seems exclusive to guests. You're constantly fighting for space and attention with outside visitors. The hotel sits above a high-end shopping mall which was really very impressive and had great stores and a wonderful selection of restaurants. However, as they are all inside the shopping mall, you…",4
"Stayed at MBS recently attending a conference in Singapore. The front desk team were extremely friendly and accomodating. My room was very comfortable with all the ammenities required. I was facing out to Gardens by the Bay which to me was till a beautiful view. The view on the city side is just gorgeous. The view from the roof top bar is as good a view as you will find anywhere in the world. Expect to spend HUGE dollars on alcohol, however this is not unique when you're in Singapore. The pool is just stunning but crowded. All in all the experience at MBS was pleasurable. Great location, great shops, albeit high end and expensive. Would stay there again.",4
"It is, like you see it in the pictures! The hotel is absolutely beautiful. We stayed on the 31st floor tower 2 overlooking the bay and it was amazing. The rooms are very comfortable and the staff were very attentive & helpful. I was worried about the check in process as it can take long at such big hotels but I was pleasantly surprised it didn't last more than 10 minutes. The infinity pool was the best part. Do yourself a favor and visit this hotel!! ",5
"Fantastic location - train and bus station right there which makes getting around the city a breeze. Wonderful service! We arrived at 8am and were offered an early check in, which was so gratefully accepted.   Had breakfast at Spago - again extremely wonderful service, can't fault it. Good selection at the buffet.   Pool area has the best view of the city and bay - but very busy at times. Head up early in the morning for peace and quiet.   Drinks expensive compared to elsewhere. But you expect that with the view and service.   Prices at various restaurants can be heart stopping - be prepared! ",4
"Granted, this place looks awesome from a distance. Who ever though of creating a rooftop park across three skyscrapers? Awesome.  However, if you are just passing through, and want to enjoy a few hours of relaxation, don't bother going there. First of all, nowhere is it indicated what tower actually provides 'guest' access to the rooftop. This means I actually traveled to the 57th floor twice before finding out that there was only one venue open to non-guests.  Then upon entering the rooftop (great view), all I thought of was: Disneyland. Loads of people, very busy, security checks everywhere and increasingly high prices. There are so many great places in Singapore, this one ain't one of them. If you really really really want to go to the 57th floor, take tower 2, then exit and…",3
I highly recommend marina bay sands. All the facilities are 1 minute away. The view is unbelievable. Casino was a real highlight for me. Pool area was extremely busy with a lot people. Maybe just one thing that out me off a little so many people cramp in such a small space.,5
"The hotel is conveniently located on the green subway line, so traveling was convenient to all parts of the city, as well as to and from the airport. It's also a great location for people who like to run outdoors. My room was facing the gardens and the private balcony was something I really enjoyed. Check in was fast and the service was great. I received everything I asked for and staff are very kind and courteous. I would definitely recommend the hotel.",5
"We stayed there only one night but it was the most amazing hotel we have ever stayed in! We upgraded our room at arrival, which was on the 47th floor with a breathtaking view on the city. The rrom was very spacious and elegant. The receptionists were extremely friendly. They guided us to the VIP check-in lounge when checking in because there was a small queue. The gym is very well equiped with a great view and very aimable changing room with sauna, steambath and hot water. The infinity swimming pool on the 57th floor is amazing and is legendary, especially at night when the lights of the city and the skyscrapers opposite are turned on! Unfortunately the food at the pool is very poor. We ordered 3 hamburgers which were very poor and a ceasar salad which we didn't even eat, so…",5
"Marina Bay Sands is a great hotel when is comes to its architecture, location, restaurant options and the roof pool (the best thing about the hotel), but for a guest at the hotel, hospitality matters too. The food is excellent with a lot of vegetarian options and options to select various restaurants. Do visit the roof top restaurant. The infinity pool is where you can easily spend 2-3 hours with jacuzzi and sauna also available  On our arrival at 8:30am, we requested for an early check-in, given that the hotel has a policy of checking in at 3pm. Though the rooms were vacant, the hotel staff was reluctant in allocating rooms to most of the arriving guests. We had to remind them 5-6 times after which finally they gave us a room (they had to select a room to allot out of the many…",3
"Large, clean and nice decorated rooms. Very comfortable beds with great views of the bay.  I think the photos of the root top speak for its self, wouldn't hesitate in staying here again. staff all friendly and very helpful.",5
"Marina Bay Sands houses a mall, a museum, two large theaters, seven ""celebrity chef"" restaurants, two floating Crystal Pavilions, a skating rink, and the casino. The Singapore Merlion and the Singapore flyer are also around the same place.  Every evening we have the light and sound show which has combination of music with Laser lights, smoke, fire and water fountains.",4
"Booked a birthday weekend staycation with my family, at the Family Room (paid $1800 for 2 nights). It's not our first time staying at MBS, due to its proximity to the casino and shopping. However, on the first afternoon a terrible incident happened which made us swear not to stay at MBS again - when the 3 ladies were in the room alone without dad, the 2 sisters and mum were showering / using the toilet in the 2 bathrooms (with the bathroom doors ajar), a room service guy personnel just let himself into the room to place newspapers we have asked for earlier in the day right in the middle of the room's coffee table (not even just dropping it at the door), when it was obvious there are people showering and talking in the bathrooms. When we fed this back to the manager, the response…",1
"We were invited to stay there for 2 nights and were quite excited! We did not except the boutique hotel experience, as clearly, a big hotel like this cant offer that.  Check-in was rather quick and we were given a room in the 40th floor, which had an amazing view over the Gardens Bay the Bay and the sea. The room was spacious, the interior design pretty standard (I guess I had just expected something to stand out a bit more...). The smoke detector was beeping (empty battery) by the time we checked-in and we had to get housekeeping right away, not a big deal, but wondering whether the cleaners did not notice this prior?  What we enjoyed most was the breakfast on the 57th floor, it was delicious, with heaps of choices and amazing food.  The biggest disappointment was the pool. It…",3
"Singapore is a great city to stay wherever you choose but to be in the Marina Bay Sands you can look out over the entire city from your clean spacious and well equipped room, before exploring the city. Staying at the hotel means you can pose and splash in he 57th floor infinity pool which is a world class experience, and thee are loads of restaurants to choose from some of which are truly excellent",5
"Loved the set up of MBS. Really nice. Loved the gardens around the property as well. Very central to most everything in downtown Singapore. Easy access. Very senic, great photo opportunities all around the property and the marina.",5
"Have stayed at the hotel twice, this time in Jan 16.  Its a property to experience but just for a night if you are paying from your pocket. Any number of days is good if it's business travel and will elaborate why. - The location is great with some great views from the high floor rooms - The infinity pool is a must dip  However, - service is not up to the mark except for at the front desk - the food is anything to write home about (am a zero maintenance foodie)",4
"The Marina Bay Sands is one of the most awe inspiring buildings in Singapore and sparkles like gold at night. You can't miss the ship shaped top of the building which offers a birds' eye view of the glittering city. The hotel has a mall inside which is huge and housing the world's ultra luxurious brands. The water and light show is free every evening outside the mall on the river side. Overall, it is a pleasurable sight and should not be missed.",4
"Stayed for a week, will never come back. If you want to share your holiday with 5000 other people constantly taking selfies stay here. Yes the view from the top is great but it's so crowded it feels like you're holidaying in a shopping mall. ",2
"If you like big Vegas style hotels than this might be the place for you. I don't and really didn't like this place. It huge, full of tourists, has no real lobby but rather a gigantic mall type space, and is not set up for business travellers. Two simple requests proved to be difficult. On the plus, the room was perfectly nice with a great view, and the pool is something else.",3
"Very large hotel which I feel has no soul about it, I believe it's now around 5 yrs old and it is starting to look tired. The soft furnishings in the bars and restaurants are stained , chipped and scratched. The check in service is very poor, you are herded into a roped off line, where you can stand for 10 minutes +. The view from the pool is fantastic although trying to secure a lounge is nearly impossible as the towels are not cleared from them by those leaving or the pool staff- getting food or drink is even harder up there. I would recommend anyone staying here to seriously consider paying the extra for the club privileges- which includes drinks from 5-7pm. At Sin. $490+ 17% per night for a club room, I think there are better hotels offering value and service in Singapore ",3
"We would normally think twice about paying this for a hotel room, but MBS is simply one of the hotels in the world you need to visit It is well known, often frequented by celebrities , offers unparalleled views across Singapore.  The sky pool on the 57th floor is legendary & has to be visited The downside to MBS is that it is simply very busy - we were in low season but check in was lengthy albeit they let us have the room for noon which was great. The pool soon becomes hectic & sunbeds fill quickly. Staff are great & helpful if they see you struggling We had a room overlooking the city which was fantastic. Rooms are large & overall well appointed, albeit plug sockets are not well placed (says my wife as not suitable for hair preparation).  Rise breakfast was superb but again…",5
"2nd time visitior, booked a room with balcony facing the gardens. Got the worst possible location on the far side of tower 1 on floor 8. I asked for a room with a nice view and this was the best they could do, haha! Overall wasn't pleased by room choice, people in my group who booked lesser rooms got much better location and preferences than I did.   Room was clean, but some stuff needed repairs. Phone cord broken so no phone, couldn't call for a replacement or any assistance.  Overall its still a nice property, would stay if I come back.",4
"Wow totally amazed by the Swimming pool view, staff was very friendly which help me on upgrading to my desire view requested by my Girlfriend. Have really a really great experience with this hotel. Will definitely be back for the future with my family member.",5
"The Marina Bay Sands stands out because of its sheer presence. It has great architecture, a good location and is well-run and efficient. However, due to the massive crowds at the hotel itself and the nearby shopping centre and attractions, it has an impersonal ambiance. There is a general ""Las Vegas"" type feel to the whole area.   We stayed in a Grand Club Room, which was extremely comfortable and well set-up for a family with 3 young kids. The Club 55 Lounge has great views, excellent food and gets you away from the crowds. As other travelers have stated in their reviews, the pool is spectacular and a stay here is almost worth it for that alone. However, it is always full of guests/visitors and the only time get the full ""pool experience"" and accompanying view is to go there at…",4
"Stayed for one night pre cruise, on arrival we were taken to vip check in and was upgraded to a city view on 49th floor,  room was lovely and spectacular views can even watch the laser show. The pool area is fantastic but was very busy late afternoon never seen so many selfie sticks in my life. Gave that a miss and went to bar great service but very expensive $27 a pint nice views. Went back to pool 1st thing in morning had pool to our self well actually myself due to fact it was absolutely freezing so wife just paddled. I'm sure it must warm up later in day.considering the rate we paid you would of thought breakfast would be included not another $50 a person extra. We again gave that a miss and went else where. The hotel has some spectacular features but because of its immense…",5
"We spent three days at the Hotel. The room is spacious overlooking a magnificent view of the lack and the famous Art Science Museum, the Esplanade Mall, Merlion Park, the shops at marina bay sands, theater, sands expo and convention center. The room has a specious bathroom with a bath top and a separate shower area. The bed is very comfortable with silky white sheets.   The Hotel has one of the most famous swimming pools in the world located at the 57th floor, that has many celebrity Chef restaurants. The pool area is a place you will not get enough of, the spectacular view is something to really remember and talk about, the pool gives you the illusion that you are at the edge of the building.  Staying at the Hotel you will have enough activities that will consume your time…",5
