Comments,Ratings
"This hotel is a little like Las Vegas... but I like Las Vegas so it fits me just fine.  A high-energy place with loads of restaurants and bars.  The hotel is huge, but I never felt that the service suffered as a result.  All encounters with the staff were great.  Location is a plus, on top of a subway station, across the street from and connected to the spectacular Gardens and the high-end mall with its nightly laser light show.  The room was very nice, well decorated, and had quality furnishings.  Pool is of course spectacular, and the pool-side food and drinks (both quality and service level) were above average.  Sure it's expensive, but it's worth it due to the quality of the resort and the high service level.",5
"Actually wizhout any additional words - just again and again amazing and breathtaking ... And again I strongly recommend: if you do it, then do it right and DO NOT TRY to save some money - you'll regret! Insist on a city view luxury room - even you may be charged more tba 500 EUR per night - it's worth it - and: pls 2 nights! Why? Do it, and you'll know! Too much to see, to do, to experience ... Sunste at sky park pool, the bars and restaurants ... And just the room itself ... Anyway, up 2 u, but take my words .... Youll never regret!",5
"Sky Park is on the 57th floor of Marina Bay Sands and is by far one of the most beautiful places to visit in Singapore with breathtaking skyline views of the city, especially at night. If you are not staying in the hotel they do have a charge, I'm not sure how much but I can assure you that it's worth it. We've stayed at this hotel on several occasions and we always look forward to coming back. A must see when in Singapore!",5
"I stayed in Marina Bay Sands (Gardens by the bay view) last year. It was really beautiful.  However I was really happy with my room this time. I stayed in city view suite on 37 floor (Club room) for 4 nights. I loved the view and size of the room. I had garden view in my rest room too. It was a super clean room with amazing view. What could be better than that?   ""Sky pool"" was a little bit crowded, but still beautiful! I enjoyed breakfast in ""Club 55"" every morning.   If you visit Singapore, you must try ""Marina Bay Sands!!"" ",5
"The hotel is wonderful and it is definitely worth upgrading to the suite. With the suite you get an amazing selection of breakfast at the lounge, as well as afternoon tea. You get to become totally full with the afternoon tea and you don't need dinner afterwards. The quality and selection of the food is superb. The rooms are massive - like a small apartment. And you get to access the famous infinity pool. Worth the money so I would absolutely return.",5
"All my expectations were exceeded. Check in was smooth, we were a little early, however the staff at the counter allowed us to access our rooms early.   Infinity pool was amazing. Lots of kids though, so not a place to relax. Prices for food and drink are expensive but that's expected.   Would definitely come back as long as I've got a wallet full of cash. ",5
"We stayed in this hotel for our last night in Singapore early January 2016. We knew it was a big hotel and there would be a lot of commotion but it was worse than we expected. In order to check in we had to queu with our luggages for 25 mins in order to get our room key (and there are three receptions in this hotel - one per tower) Not much was explained concerning where the pool was located nor how to reach the garden outside. The room was good, and the bed was quite comfortable. The pool was extremely crowded as we assumed and the water was incredibly cold! Also you need to take a specific elevator to reach the pool which is confusing as when we asked staff members for directions they all had different anwsers on how to reach the pool. The staff was very helpfull and quite…",2
"My fiancé & I stayed at Marina Bay Sands for 1 night, we spent the day at the infinity pool rekaxing.  We were so surprised at the exceptional service received from all employees but especially Karla and Maricor! We expected a high level of service but this hotel has left us speechless! Well done,  we'll be back again! ",5
We spent only one night. We took a city view room in upper levels (tower 3) and saw the beautiful view from the crazy swimming pool and the terrace at night (to see Gardens by the bay). We choose this hotel to see the swimming pool and to go easily to gardens of the bay. The service is not personnalized as there are too many people and we got several different answers at  the same question. The breakfast is very nice at the terrace on the roof You need to go down Gardens by the bay if you want to see the show (it's a little bit too high and far from the terrace of the hotel),4
"I haven't come across another hotel foyer that is so busy!!  There were people standing in queues at the front desk and outside the hotel. Unbelievable that people can be so patient!! A very attractive interior with high ceilings, wooden panels and lots of glass. ",3
"This is a huge hotel. So big we didn't see all of it. The sky infinity pool really makes this place. There are some stunning views of Singapore. We really enjoyed our stay here and it is well worth doing at least once! We managed to get a very late checkout too, thanks to the friendly hotel manager. Really helped us out!",4
Marina Bay is so different from places I have seen before. On one hand overwhelming nature and on the other hand everything designed with this amazing perfection and idea in mind. Very unique and definitely place to see!,5
I spent some 2 hours each 2 days in the casino at the hotel...What a large casino..I enjoyed and had great great fun..definitely a place to visit when in Singapore. Entry for travellers is free. Residents and citizens are charged SGD 100 for entry,4
"It is a plesure to see such modern architecture, people are limitless. Now you can swim at sky! I can name Marina Bay Sands as an extraordinary hotel. I felt like I'm in ancient Babylon for a second at sky pool.",5
"My family and I stayed here for the formula 1 Grand Prix in 2015. From start to finish this was a fantastic stay. On arrival we were escorted to the VIP check-in, a stunning room with serene decor. Complimentary refreshments were provided whilst my husband checked us in. We were upgraded to a higher floor without any prompting.  The room is clean and modern and the view of the bay was superb.  The breakfast was great and timings convenient. Throughout the weekend the hotel was buzzing. The atmosphere was second to none. Numerous dining options and shopping spots are endless.  The ultimate is the rooftop pool...it is spectacular and is a must to experience. As a hotel guest you have priority access. However, I do feel there should be a part of the day were only hotel guests may…",5
"The best location in Singapore, great service, stunning view, best suites ever . Great service, very good restaurants, near the shopping mall, very nice casino, and very friendly staff. Next time we will stay again in de Marina Bay Sands for sure.",5
"This was my second time staying at Marina Bay Sands, my partner's first. I came back to Singapore, solely (well one of the main reasons), to stay at MBS again, and purely chose the hotel because of it's 57th floor Infinity Pool. It's simply amazing, the views across Singapore are some of the best in the world, the skyscrapers feel so close you can touch them. There are however many other great things about the hotel as well.   Rooms are spacious, ours had a small balcony overlooking the Gardens by the Bay and the ocean where you can try and count the abundance of ships anchored. It's truly a sight to see. The hotel is fully equipped and being attached to the shoppes at Marina Bay would benefit the designer seeking fashionista.... But beware, you need some serious $$ or credit…",5
"We stayed at this hotel in Aug 2015.We booked 2 rooms asking for one of the rooms to have twin beds as I have a son & daughter 18yrs & 15yrs old.  Check in felt like I was on the airport really busy had to queue up wait for ages. At the desk I requested to the receptionist for interconnecting rooms with one of the to have twin beds, she said yes that's already on your booking.  We were then just told at reception to take the lift to our floor given the keys.  No one showed us up to the rooms. When u pay this kind of price for a 5* hotel I did expect the courtesy for a member of staff to at least take you up to your room show u the facilities.  Once we found our rooms both bedrooms had king size beds,I rang reception she said she would send someone up straight away to sort the…",3
"Location is the best you can get in Singapore. You have it all in walking distance, shops, great restaurants, parks etc. Skypark is very unique and magical, would not like to leave at all. Rooms are huge and more beautiful than in the pictures. A tip: do not leave the pool as long as the sun is shining, next day it might not. Sunset and sunrise both are worth experiencing by the pool. The only minus is that you cannot spend the day by the pool after you have left you keys.",5
"So I have stayed at Marina Bay Sands a few times now. Generally its a decent hotel. Its too large to expect that personal service but id say its clean and well kept hotel. Big rooms, fast internet and untold facilities. Its golden crown is obviously the infinity pool on 55th floor. Not sure it would have as many visitors without it. Food is over priced but you get used to that.  Now the real bad bit.....as i write this I am trying to sleep in tower 2 on the 22nd floor at 11:20pm. There is a rock concert on (Laneways Festival) directly behind the hotel in the Gardens By The Bay. The volume of the music is literally shaking the double glazed windows and can feel the bass through me sat in my room. Now correct me if this is wrong but what moron gave the go ahead for such a festival…",2
"So, whenever we went to Singapore,  we would make the effort and save up to stay at Marina Bay Sands hotel. Our first experience was such a delight and really unforgettable, so we thought why not relive it.  However,  our last few stays were sliding downwards to being quite mediocre.   Firstly,  check in was almost a 30minute experience. Im not sure why it took so long, especially when it was all prepaid already. Not to mention, the lady serving us was showing some disdain we were taking up her time.   Secondly, we were placed in tower 2. Outside our room, well noisy. This was from the noise of the lobby and its restaurants. It was  also not mentioned during check in that there was a music festival going on outside.  Which we could hear the bass quite clearly through the closed…",3
"This is a GIANT hotel with hundreds of guests and rooms its pretty chaotic but the staff handle it with ease. they have an amazing modern asian cuisine restaurant in the hotel. The day spa is fantastic, massages are world class. pool was way to busy even at 9:30 at night. Gym was fantastic for a hotel. Views are unbeatable, I wouldn't stay anywhere else in singapore.",5
"Upon arrival, we received a complimentary upgrade to a better suite overlooking the Gardens By The Bay. There was a huge line, but we skipped, maybe it was just our luck. Its famous infinity pool had a stunning panoramic view of the city skyline. The hotel runs alongside Singapore's largest mall, which had absolutely everything we needed.",5
"I love, love, love this hotel! Stayed for two nights on the deluxe room of 33rd flr. The view is breathtaking! The room is spacious and elegant-looking. The have great customer service, making sure our stay is more than comfortable. I love that we could just hang around at the pool anytime we want or take a stroll at the mall.",5
"Singapore is lovely destinations for all sorts of tourists. Very easy to navigate, exhilarating spots to see, wonderful people to meet, cheap transportation, and exotic destinations to stay, eat and enjoy. Every year one finds something new there and we get a feeling that this is our first visit.",5
"We were very impressed with the hotel and it's location.  We arrived too early for our room to be ready upon check-in, but it was no problem for concierge to store our luggage. Front office reception gave us keycards to access the infinity pool area and explore the hotel while our room was being prepared. The whole check-in process was very fast and the staff very pleasant. We took the elevators to the 57th roof-top to see the infinity pool.  Wow! what a view!  It was 9:00am and the pool was  quite busy.  However we found that if we were at the pool 6:00am when it first opened, we were on our own for the first hour. We managed to get our morning swim, take photos and enjoy sunrise before the crowds. There are also jacuzzis on the roof top.  Our room was in Tower 3 on the 37th…",5
"Very expensive and definitely not worth the money.  Nice room.   Crap services. Sitting here after check out and there are no seats or lounge areas.  You cannot access the pool area.  All shops are owned by marina bay in walking distance so all casino style fake stores. No heart, no real owners.  Wow. $500 for a bed.  Stayed at the hotel oasia this trip also. Under $200 per night and a better hotel and much better service and location. ",2
We come here with Changi airport facilities when we transit from Kuala Lumpur to Phuket.  This building is good and eye cathing.  I will go there again if Ii go to Singapore again.  It was free access from Changi with a good guide,3
We splashed out and got 2 suites with access to the Club breakfast and all the special things that comes with that. I had tried to book a suite at the Ritz Carlton but could not get their web site to work and they did not replay to me email. Marina Bay Sands is a magnificence building and the shopping centre is amazing. Must stay place! ,5
"Even if the property has a lot of rooms, the staff was very professional, very careful, prompt and offered real 5* services. I expected to wait a lot at ck-in and check-out and I was very pleased to find out that we didin't wait more than 5 minutes. The pool was great with extremly nice staff, great view. The room was very clean and with great view from the 37th foor.",5
"We absolutely loved Marina Bay Sands, and Singapore!!   We arrived two hours early, and were able to pay for an ungraded room and get access immediately. (No queue at check-in when we arrived).   I had booked a club room, but the upgraded room we received was bigger than the room I had booked. Our room was on a high floor and OMG what a view over the bay!! We both just stood there for ages saying wow!  Our room was massive, with a huge super comfy bed. Separate dressing area, and massive bathroom with huge bath. The toiletries supplied are nice – I never bothered unpacking mine and just used those provided by the hotel.   It is definitely worth paying the extra for a club room. Breakfast is included, and there is a massive choice, something to suit everyone. No queues for a…",5
"very good hotel with casino staff very good, a little bit long queue at check-in, it takes 30mins +- to check in every single time  room very good, very nice swimming pool on the rooftop  so many delicious food downstairs  nice view",5
"Too big , the lobby is like a Trains station at Rush times , the swimming pool at the top is funny , very good food at all restaurants, Rooms are normal for the price . Swiming pool at the top floor is worth to see  ",4
This place is ridiculous. I have been to 5 star hotels but this is more like an airport! So busy with people with their bags flying everywhere it's worse than universal studios! If you want a relaxing holiday do not stay here. The breakfast is so busy and stressful it's worse than a theme park. My fiancé and I wanted to look at a menu for dinner that night but were quickly turned away by a rude staff member who suggested it was too expensive for us and wouldn't let us look at the menu when we were very interested in going to Wolfgang pucks restaurant.. So we went to his other one instead.  The room is very nice though with a decent view but who wants to stay on their room all day. The pool of course has a nice view which you can see anywhere else perhaps but is way too cold to…,2
"If you want to have the best views of Singapore, day or night, then Marina Bay Sands is the hotel for you. We always stay here whenever we are in Singapore, the service and staff are super friendly and accomadating. They have one of the top rated Infiniti pools in the world that in on the roof located on the 57th floor, called Sky Park where they also have restaurants, and clubs for nightlife and fine dining. You can also visit Gardens by the bay which is breathtaking while overlooking the Singapore Flyer. This hotel has it all, Great location on the water, shopping mall, Casino, Entertainment and so much more. ",5
"This hotel has turned into a Disney Land attraction. Sure the building and overall architecture is impressive. But if you want value for money and a somewhat personal atmosphere do not stay here. Breakfast has gigantic queue, restaurants are packed and the price you pay is sky high (as high as the building itself)   Don't come here if you're expecting to relax. If your aim is to visit and take selfies from the infinity pool, then go for it.",2
"The architecture is amazing. The infinity pool is a dream! We stayed few nights in the Marina Bay suite, ohhh I think it is my favourite hotel ever! If you have to visit Singapore, go there! Bars, service, restaurants amazing as well",5
"Let's start with this being the MOST amazing building - and for this reason alone makes it worth a stay. PLUSES:  The swimming pool on the top floor is extraordinary - fortunately they have now restricted this to hotel guests only with entry via room key turnstiles.  The rooms are modern, impeccably clean with great views from either side of the building.  Close to the beautiful gardens.  It links easily to the huge shopping arcade and casino. Excellent wifi too. MINUSES:  It's big and busy!  Check-in took a while and it's a big place if you want to get around easily. Overall HIGHLY RECOMMENDED - will definitely stay here again.",5
"Our room was on the 53 floor on the Marina side. Fantastic views from floor to ceiling windows. The rooms are basic hotel rooms, but nice. The real reason to stay at MBS is for the view. The pool has a fantastic view, but need to get up there early to get a spot. We found the lounge at Spago to be fantastic for evening drinks. The spa at MBS is the Banyan Tree, which does great massages from rooms with views. Not a place to go if you are looking for exclusivity, but overall a relaxing stay.  Overall, great stay and would go back.",5
i like it very much when check inn i take coffee and then have tea at breakfast clean and clear room and rate is excellent wao great hotel and great facility,5
"A wonderful casino with large number of table games and slot machines. Free access to foreign nationals, but ensure to have your passport for casino entry. Definitely a recommended visit with a decent payout ratio, and they serve drinks and food within the floor.   But mind the excessive amount of smoke within the casino, which can be annoying to a non smoker.",5
Even though it was just for 1 night I had a blast. The room is big and mine was facing the city. Loved it. The bathroom is awesome with a tub and everything. Really huge bathroom. The infinity pool on top was fun to try. Not so crowded as you expect. Easy check-in and check-out. Did not have breakfast there so can't tell. But again it sure is worth a stay. ,5
We were put up here for a business conference. The venue was the location across the road. So not much time spent in the hotel.   The rooms are large. Wifi speed is excellent. No restriction on number of device. We had four device connected at the same time.,3
"The infinity pool looking over Singapore is spectacular!  A must see, that exceeded expectations. The table service by the pool is excellent, however a few extra selections on the pool bar food would have been nice. We were there when the haze in Singapore was exceptionally high, so will be back for a clearer day! The rooms were also fabulous, large glass windows for a breathtaking view, we paid extra for a city view room and it was worth it! Make sure you go to the pool at night to see Singapore's financial district lit up! ",4
"Stayed at Garden view room and the view is beautiful. The room has a balcony too. The toilet is huge and the bed is a huge king size. Average room, I do give it 4 stars.  The view of Infinity Pool is stunning. It's beautiful at day, sunset and night times. However, it is crowded most of the time. The pool is only strictly accessible by hotel guest only. Great for crowd control. So please bring to room key if you're planning to visit the Infinity Pool for entrance. As for the Observation deck, it is accessible by both public and hotel guest. If you're not a hotel guest, you'll need to pay for a entrance fee but still will not have access to the pool.  Directly connected to the shoppes and is only a few walks away from gardens by the bay, helix bridge, Singapore flyer etc. great…",4
"The Marina Bay Sands is one of those places that you just need to journey to for a unique experience. The soaring lobby, rooftop infinity pool, views for the sky deck lounges/bars, are what sets this place apart from other hotels. The room was very well equipped and comfortable. But it is the other areas of the hotel that let you know, ""you are not in Kansas anymore"". In the evening take your camera and move towards the edge of the infinity pool at night and as you approach the edge 57 stories above the ground you can feel a little dizzy, but you will be treated to a city skyline light view that you will not see anywhere else in the world from a pool. I could go on and on with features, the endless shops/restaurants just outside in the covered mall, the view from any room is…",5
"We chose this hotel as a special treat for my 50th birthday. And we wasn't disappointed. The views were amazing from the top.  We was upgraded to a suite on the 53rd floor which was huge, and had stunning views of the city. The rooms were clean and tidy and housekeeping did a great job. The infinity pool was good but did get overcrowded at times.  The restaurants were ok but expensive, i would recommend a short taxi ride to Clarke Quay for meals and drinks.  Overall a great place to stay and would highly recommend.",5
"We organized a regional sales meeting in Marina Bay Sand but the booking process is slow and inefficient. They requested to fill up form, front and back credit card images. Scan and email to them after several calls and email communication.",1
"I booked a room for my parents for their anniversary, and I'm so happy I sprung for the cost. We all had a great time, and I was able to make them feel special on their special day.   I asked for an upgrade, and reception granted it when I told them it was for my parents' anniversary.   The hotel is more expensive than others, but you can't beat the experience. It's clean, luxurious, and high end. Apart from the much touted infinity pool, definitely try the boiling hot jacuzzi pool at the roof top. ",5
"The Marina Bay Sands is easily accessed by City Bus Service. The Soaring, Majestic Foyer is Delight to the Senses & Uplifts the Spirit. Entry Fee to the Observation Deck is rather Stiff. The Wooden-floored Observation Deck, High Up in the Sky, offers an Enthralling 360-degree View, including Glorious Views of the outer Harbour. Illustrated Panels at several Locations on the Periphery point out the Important Singapore Landmarks on View. Absence of Seating on the vast Deck limits the Time to as long as one can Stand - or plonk on the wooden floor ! Refreshment available is very limited. Overall, not a Great Value-for-Money.",3
The Marina Bay Sands is an awesome hotel.  The sheer size of it takes your breath away and naturally the highlight is the enormous infinity pool at the top.  The rooms are huge and the service immaculate.  Well worth visiting if your budget can stretch it.,5
"Just stayed in MBS Hotel over the weekend and would like to feedback on a few good and poor areas.   Good: Bed and bathtub is huge and comfortable.  Bad:  1. We booked a Garden View Premier room on MBS website but was given a room with city view. When we called the frontdesk to check, we were told that Garden view and city view rooms are assigned to guest subject to availability. I do not remember seeing this clause while doing the reservation online. The most disappointed part is the so called 'city view' is very bad facing the shopping mall and taxi-stand.   2. The layout of the room is very different from what you saw on the MBS website. Bed is facing the window instead of TV. We need to tilt the TV in an angle so that we can watch it from the bed.   3. TV remote control is…",3
"Great architecture and definitely work looking at. As a passerby, this building is impressive. The location is convenient and the building is just breathtaking. This building views well from across the harbour and right up front.   The hotel itself is a very typical 5-6 star hotel. The service is excellent and the services they provide are top quality.  However, I do recommend staying on the upper floors (even for a premium) as the views from the lower floors seem to be very limited. You also get your own personal balcony. Nothing to complain about at it.",5
