Comments,Ratings
"I can only say good things about this place.  Spectacular scene, especially the view from the infinity pool was gorgeous. The price is relatively high but for all the service what you get and the very modern and clean rooms, it is justified. They offered me to take a shower when I was already checked out and I had a late Airplane. ",5
"Been there twice! Such a spectacular infinity pool and the room is luxurious decor! This hotel has everything that u r looking for in Singapore, the huge high end mall, delicious food court around the side and casino can full fill your trip in marina bay sand!!",5
"Stayed for two nights and what a hotel. The view from our very large room looking over the sea was one thing, but to use the infinity pool was another. Fantastic views over the city but also the attention from the staff regarding drinks/food was very impressive.  Well worth the extra to go there. Breakfast was self service in the main lobby with an amazing selection of foods. Cannot fault it.  Meals in the area however are expensive so be careful where you eat",5
I just stayed for 1 night with my family coz i just really wanna experience the infiity pool. The guy who helped us at the front desk he was really nice helpful he even offered us a bigger room. The thing i didnt like is book for 1 room and only 2 people and 1 child can accomodate while theres a king size bed and 2 twin bed. I think they should be flexible on this. Infinity pool is worth it the view OMG stress free specially during the morning time I went to swim twice morning and night time to see the view at both time. I will definetely going back.,5
"Had high hopes for this place and was initially dissapointed. We took a flight from Bangkok purely to stay here. When we arrived we were put in a room on the second floor over looking a busy moisy road. We hike back to the reception immediately and asked for another room. The receptionist apologised and offered us another room with a late check out as an apology - we have a 9am flight!!! The place was huge and very impersonal. The pool was amazing buy heaving and very difficult to use and no way of relaxing. We tried to go into the roof bar but were told we had spend a minimum amount of money each to goin there -about £20 each. The surrounding area is very good. Singapore was great, spotlessly clean and the people were fantastic. Wish we had chosen on of the less touristy hotels",3
"You pay for what you get and this is no exception. The room was impeccable, the bathroom a palace, the view magnificent, and the staff very friendly. Be wary of the $14 drop coffee at Spago but do devote as much time to the pool as possible. Would definitely stay here again. ",5
"Stayed a week in this hotel during a business convention. It wasn't my first time in Singapore but first time in this hotel.  I must say that although the Hotel is pricey, you get your money worth.  Amazing views of Singapore from very modern rooms, food to ""live"" for, and the most likely, the spectacular roof top infinity pool in the world.  If you can treat yourself when going to Singapore this is a Must stay ",5
The hotel is a lot like a Vegas hotel.  Connected to a very large mall with very high end stores. Be prepared for very expensive meals and drinks all through Singapore.  Very pretty gardens across the street!  The zoo and the Botanical gardens are also great.  Loved Little India and China Town.  The pool here is amazing!!,4
"It is worth to come here just because of the room and the pool on the roof.  The room on 45th floor in tower 1 was unbelievable.  The view is stunning.  Huge window, all things working well.  I think they need to bring more towels, we were 4 people in the room - 2 adults and 2 children, and we constantly needed more towels, but the hotel did bring every time we asked.  Some of its service people speak only Mandarin and the communication was not always perfect, but some of them had small dictionaries and used them actively.  The pool on top is an adventure.  As a pool to swim, it's nothing special, but it's a great feeling to be there, either on the sunbed or inside the pool and watch the sky and the view.  The feeling is great.    The service in hotel varies.  In the restaurant…",4
"We stayed here for one night at the end of March, having returned to Singapore from a tour of Indonesia.  It was the perfect stop over prior to our flight back to the UK the following day.  Our room was a marina view room and the advertised view, through the floor to ceiling windows, was magnificent.  Downtown Singapore was there in all its glory, from the seaport across to Raffles and beyond.  Very good. On arrival the hotel is daunting as it is absolutely gigantic.  The check in process was smooth and well ordered however.  In addition the girl on the check in desk spotted that it was my birthday, from the passport, and by the time we got to our room there was a complimentary birthday cake (gooey chocolate) and bottle of wine waiting for us.  This was above and beyond! We went…",4
"I paid $550 for a room that is on level 3 with no view at all.  The check in is like an airport, saw multiple people walk off unhappy with the service.  Air conditioning in room doesn't work, have it set on 18 but the temp doesn't go below 24.5.  Food and drinks are outrageously expensive.  Lifts don't work half the time and start going up but then change their minds. You have to catch 2 lifts to the pool of you on level 33 and below. Takes a good 5-10 minutes to get up there with all the stops. People reserve all the good chairs at the pool and don't use them.  Pool is good but I wouldn't pay again to stay here.",1
"We stayed for two nights travelling back to the UK from Australia. We had previously stayed elsewhere in Singapore but were determined to try this one out, and we were not disappointed. Once you come to terms with the awesome size of the complex, it is a fantastic place. The hotel rooms are huge with everything you want and the most amazing city and marina views. The highlight however, is the rooftop infinity pool which was far bigger than I imagined so did not get crowded. The views at night are spectacular with day views almost as good. The attentive staff at the pool were brilliant providing towels and drinks at the blink of an eye. Everyone seemed to use the robes in the bedrooms to travel up to the 57th floor pool so changing was not necessary. The food in the rooftop…",5
"I got a wonderful room facing the sky gardens to myself and my friends got a room on a really high floor overlooking the bay. I mean really there is nothing that I can complain about in this hotel. It is divine. The rooms are fantastic. It is also really really huge so might find yourself walking quite a bit since it also has its own amazing shopping complex. It was good except for the price tag. I mean it is really really expensive. The infinity pool ofcourse goes without saying was amazing itself. Would i recommend it yes, but only for a short stay or longer stays if you have deep pockets. There are amazing hotels by clark quay that are much cheaper and equally amazing.",4
Fantastic weekend spent with the family. Kids had a great time. Lovely pool area. Wide variety of restaurants. The view from the room was breath-taking. Service was prompt and attentive. Staff was courteous.,5
"If you will stay here, you won't care too much about the cost. You will have an amazing view from the top, but for this kind of hotel was very dissapointing that the infinity pool was cold without warming machine. On the top there are a nice bar to visit by night, under the hotel you will have the most fancy shops to make your shopping. And of course, outside you can see from the room the Gardens(January 2014)",4
"The hotel is great at almost every level - the rooms, the view, the pool, employees. And we got a room upgrade that even improved all that! The only thing that could be changed is that early check in is allowed if there are available rooms. This time they didn't even checked.",5
"A huge hotel industry running so smoothly at the best area of Singapore . It has a amazing structure , no exaggeration  in saying that it is a symbol of Singapore . The entire area is worth experience ...casino,  mall inside , food joints inside and near art museum .all well connected . 56th and 57th floor (infinity pool) are real relaxing and happening area . Gym is also very good . Nice restaurants  inside .  But as a traveller I can say it is very expensive place for entire stay of 5 or 6 days in Singapore . Two big problems...big lines for check in and clear your bills while checking out and not enough number of family rooms at proper rate . So when you are with kids you have to take 2 rooms ...and so pay double with staying separate ",4
"One of the main highlights of this hotes is the infinity pool located on the uppermost floor. Their infinity pool has a very nice view. The hotel also has a ""laser show"" during the night. The infinity pool is much better during the night since the building are all lit up. ",5
"We absolutely loved this place. Wow the views blew us away. It is a must see attraction while in Singapore. We took the Hop on Hop off bus and it stopped straight out the front. You can buy the ticket there it from your hotel(which we did) you go up to the 56th floor and the views are magnificent. Just a tip though,if you want to have a drink or something to eat you have to go back out to lift and then go up to ghe 57th floor seemed a bit weird to us.",5
"The only reason not to rate this excellent is that checking in can be complicated because your room can be in any of the three towers and you don't know that until you check in. Otherwise the room was superb, the staff really went the extra mile to make us feel welcome and valued guests, and the whole experience was fabulous. The views from the pool are outstanding - swimming on the 57th floor is an unbelievable experience.",4
"My second time in this hotel and I must say that second time was as good as first. Usually you get used to things but this hotel is superb. Rooms are extremely clean and well maintained. Pool on the roof is something, you just want to stay there. As the only minus I can mention long line at the breakfast and too many non hotel guest in the lobby.",4
"It has a stunning view over the rooftop swimming pool where we can see Singapore. I feel either in the night or day the panorama are stunning. I would suggest booking rooms on high floors as the outside view from the window could give a beautiful impression of staying in Singapore. There are two options either garden view or city view. Both are good depending on what sort of looks you like to see.  City view will make you see high rise buildings in Marina area while garden view will show you garden by the bay.  The room is nice. The amenities are excellent as well. The hotel staffs are also friendly. When we need something, we can just easily ring the telephone and they mostly respond it quickly. I tried the room service and found the food were tasty and the price were…",5
"Once I have left Marina Bay Sands I doubt I will remember a single detail about it.  Furniture is modern and uninteresting; decoration is minimal and uninspired, and does not at all reflect the colorful city of Singapore.  $600 gets a dull 13th floor view of the ship channel.  While the Marina Bay area is entertaining to look at for a couple hours, the hotel is well away from the more interesting traditional areas of the city.  Apart from the view from the unique roof, the Marina Bay Sands might as well be a Marriott in Dallas.  The two stars in this review is heavily weighted by value for money.  It is obviously not a two star property in terms of amenities, or cleanliness, which is impeccable.  Basically, if you are spending this kind of money in Singapore you can do vastly…",2
A wonderful hotel Very special hotel has a site that does not like him and has a swimming pool distinctive world And views of the garden also featured And proximity to the cruise And all the distinctive restaurants,5
nice place nice hotel nice view nice people nice service nice moment nice pool  the best spot at singapore the best moment with family  must visit this hotel and place..... expensive with expensive view with family  tempat paling pas untuk merayakan pergantian tahun baru  ,5
"The check in is more like an airport check in rather than a hotel, it was quite impersonal. We ended up getting put on a low floor so decided to pay to upgrade although they could still not confirm if we would get the view we paid for! The rooms are quite average considering our bill came to $800 for one night.   All that aside the pool is truly as amazing as it looks, we were lucky as it was a Monday and not as busy so we pretty much had the pool to ourselves. If you book on booking.com check the night before as you might be able to get an upgrade. Don't attempt the mini bar unless you want to pay through the nose and I would also recommend eating outside of the hotel as our one sandwich with crisps cost over $20.   I would go again just for the pool though!!",4
"Fantastic hotel, main attraction is infinity pool on top floor with views into Singapore. From one side of the building can see floating pavilions, esplanade, Merlin and ArtScience Museum in shape of lotus. On that side can view laser, light and water show at night.  On the other side view onto Sky Park and Singapore Flyer.  Whole complex is huge with casino, enormous shopping mall, multiple restaurants, cinemas, theaters and skating arena. Restaurant next to infinity pool is very expensive. Metro station is 4 min walk from the hotel. Sky Park is short walk from the hotels across the bridge. Sky Park looks better from far away then from the near. Worthwhile to go up to the bar on the top of one of the constructions in the middle of the park (there is entry fee) because of the…",5
"I really only wanted to visit the Marina Bay Sands to swim in AMAZING pool but you have to be a hotel guest to get that privilege... and with rooms being in the very, very expensive, it wasn't an option for me.   I did shell out the $20 to go up to the top on the Observation deck just to the left of the pool to see amazing views of the city and Singapore Harbor. I think it was worth $20 for the views and you can hang out as long as you like. Maybe not worth it if on a budget.  Other than that, the hotel itself from walking through it was very chic and glamorous looking. Very, very vast and Las Vegas like with a built in gondola river or something that you can take boat rides through the hotel I suppose. Other than that, it's a lot of over priced, designer shopping.   I went to…",4
"We booked the Club Room and we got a fantastic view from our room at Tower 3 on 46th floor. we were requesting baby crib for our 1 y/o son, amazingly it came at the same time as our luggage. Staff are very friendly and helpful. The infinity pool is amazing. Breakfast at 55th floor also very good, our kids love our stay at the hotel. Express checkout also very useful.",5
"Stayed the night as a couple. Rooms are as usual all well maintained and very clean, sheets beds all up to top standard you would expect. Rooms are spacious and good, not cheap thou. Infinity pool is really amazing. No matter how many times u could always swim and be amazed. Vegetarian food in breakfast buffet is good with abit more variety than most other hotels. Would recommend for holiday or staycation. The view from the room is just beautiful ",5
"My wife and I stayed here for nights in a room on the 43rd floor, the room was a good size with a separate lounge area and a terrific view. This is a bustling hotel with many rooms spread within the 3 towers, there is always people checking in and out any time of the day or night. The pool on the 57th floor is truly amazing, with a unique vibe and amazing view, this is not to be missed. You get free access with your room key and it is always busy, we decided to go up there at 8am one morning for a couple of hours before heading out to explore Singapore and expected it to be empty however to our amazement it was already three quarters full. That goes for the whole hotel, people everywhere. There are many dining options within the hotel, we had cocktails at Adrift lounge one night…",4
"This is the four times i visit MBS hotel,, first visit stay for 2days, second for oneday, third for three days , and the four times stay for oneday... I'm always choose MBS when i visit Singapore,, How many times my colleague said there are no worth it stay there ,, i don't care,, i'm still choose Marina Bay Sands,,, because MBS always makes me feeling Prestige, Premier, Success while i'm enter the lobby hotel,, I love that feeling,, I love watching people around there,, All are in confidence , busy, and love the staff with a style,, and don't wait too long while checkin ,, The staff is really polite ,skillfull and friendly,, Last visit,, they upgrade me to a more large room with a very beautiful view in the morning,, really amazing,, I'm always choose premier room,, cause…",5
"We spent two amazing nights at Marina Bay Sands and loved it.  We opted for a Club room, so check-in was a breeze as we by-passed the other long queue.  From there it was a quick (well almost quick - I chose the wrong elevator the first time and only got to floor 20 - but after that it was quick) zoom up to our room.  Awesome views awaited and we were suitably wowed.  Then we went up to the Club room for drinks and canapés and even more fantastic views. The service we experienced from check-in to check-out was exceptional.  The room price was high, I thought, but for two nights we believe it was worth it to be able to say - Yeah, been there, done that :)  And we are glad we did.",5
"One of the best hotel in the world, the staff make you feel like a King... Really.. Very comfortable rooms, clean ...Fantastic!! The arch. Of this building is amazing. Gardens by the Bay... You must go.. Very modern and nice city.. You can walk with no fear at all... Clean. Simply the Best!",5
A truly TOP class hotel however somehow the 5 star exclusivity and privacy is sadly missing.  Highlight must be the roof poolside. With awesome city view.  Restaurants were tough to book. Due to their brisk business.  Overall I wud say a good experience for sure,3
The lobby is crowded with people during check in/ check out period. We never expect the room is so big (because most newly build hotel is small) and it's also comes with a bath tub. Nice room over see Garden by the Bay. The hotel also provide free WIFI. My little girl loves the swimming.,4
amazing hotel good site staff are excellent they upgrades my room because this was my honneymoon near markets .different ways of transport the room with nice view amazing pool every thing was excellent except restaurants were expensive to me,5
"Club Room in 40th floor with fantastic city view. Amazing Infinity pool in 57th floor. Great service and very friendly staff. Very expensive place to shop. Decent size food court, different food options to choose.",5
"My friend's grandparent's friends had a free hotel stay and decided to let me and my friend have it! It was for Marina Bay Sand's Premier Room. The room was really lovely! My favourite part of the room, besides the view, is the HUGE bathtub! I don't have a tub at home, so it was nice to relax in the bath on the first night.  The only problem I have with the room, is that the shower knob was hard to turn when I was showering. (Hands were wet, no friction)  check out my facebook page and blog for more photos and a room tour. (link in my profile)",4
"The focus of this hotel is definitely the views - whether it be from the room or from the infinity pool at the top of the towers! The room itself was lovely, clean, on the 37th floor and with views out over Gardens by the Bay which were stunning late at night or during the day. My partner and I were able to book dinner at CÉ LA VI, which has an incredible menu coupled with incredible views. We followed this delicious dinner with a late-night trip to the infinity pool. I was worried we weren't going to be able to get beds but there were beds, as long as you went looking for them. The pool service was lovely and we enjoyed a Singapore Sling while overlooking the city lights. The only thing we thought was a shame was that the pool definitely wasn't clean. Express check-out was…",4
I stayed at MBS in March 2016 for a conference. Both the hotel and conference facilities were great. Very friendly staff in all the facilities within the hotel and conference complex. Rooms are modern and very clean. Views are stunning both day and night and there is plenty to see and do in the area surrounding the hotel itself. Pool and sky deck were amazing. Will definitely be back for a longer stay.,5
Amazing hotel spread between Gardens by bay n shopees. Booking is tough. Went there during September  F1 night race.  The view from the top floor rooms is amazing. Avoid September October period as it russhy russhy due to F1 guest and celebrities.,5
"Beautiful hotel and amazing views!  We live in Singapore and treated ourselves to one night at MBS.  The pool was very pretty, though it can be crowded with picture takes at high points during the day.  Great pool side food! Some of the best that we have had.  The rooms were exceptional and perfectly clean with very comfy beds.  Room service food was mediocre, so I would recommend eating at the poolside or one of the many restaurants in hotel. The staff were all amazing and very helpful.  You do have to carry your room key around with you and to get to the pool, but seeing as how the general public can access the top, it makes sense that they do this since you are paying for the pool more or less.  Wonderful stay!!",5
"Worst customer service for a hotel with more than 2 stars. Actually I've stayed in complete dumps where at least the staff can be polite and friendly.  I was travelling with three others including a two year old. It was difficult to get connecting rooms. We spent ages trying to get them to confirm we'd even be in the same tower, but they were very clear they won't confirm we have connecting rooms, I don't think they would even confirm being on the same floor. It's always nice to know that your stay in a hotel the next day might significantly separate your family.  Before checking in I went to sign up to be a member. The one counter was closed with a guy standing right there. The best he would tell me is he'll open ""in a while"". He didn't look at me when he did finally open. Not…",1
"Overall i love my stay here. Great room, staff, swimming pool and shopping mall  But what amazed me here is the hotel security team  Due to my negligence i felt to leave my mobile phone in my room floor. I just realised that i left the phone on my room when i make a trip to mbs art n science museum. Then i checked the phone on the room to found it somehow not there. I simply contact the hotel room service regarding my situation and told me to update if they found and news regarding my phone. I scared its thrown away with dirty towel by cleaning service.   To be honest i never put to much hope that the hotel security will find my phone again. Amazingly they manage to call back after 2 hours and said that they found my phone around art and science facility.   Once again thanks to…",5
"Marina Bay is what you call 'class all the way' Its the place to go if you want to feel flash and expensive... all the way to going to the 'skypark' in your complimentary dressing gown :-)  There is a 5 star shopping centre attached to the hotel, complete with Casino and train station, and the botanical Gardens across the other side.  Warning about the shopping centre, you WILL NOT find any Bargain shopping it is Chanel, Louis Vuitton, Rolex, Gvenchy, Bvulgari alllll the way  Event eh food is expensive 5-star stuff.... sheaper shopping can be found at Harbour side (towards Sentosa Island)  Whilst generally the service was very good... front desk service was annoying including the fact we had to keep getting the cards re-programmed and you can't go anywhere without them.  Sleep…",4
"I have stayed at Marina Bay Sands for 3 nights and all I can say is wow! I contemplated booking this hotel as I saw a lot of positive and negative comments on here, however in saying that I am glad I booked this hotel. The check in service is quick, I was given a free room upgrade to the 42nd floor with a city view which was amazing! The pool itself is what brings everyone to this hotel, it is always busy with people taking photos so don't expect to 'swim'. There are also plenty of chairs and the view is spectacular!  THE POOL CAN INKY BE USED BY GUESTS STAYING AT THE HOTEL. The fitness centre is great & by staying at this hotel you are also able to get a discount at the celebrity chef restaurants.  I will be staying here again if I return to Singapore. ",5
"From the curtains that open automatically when you enter the room to the large marble bathroom to the view from the balcony and the sheer size of the room compared to the Singapore average, this hotel stakes it's claim as a cut above the norm..... but then so is the price!    Needless to say the bed is very comfortable and all the facilities and amenities are high spec. However, due to the sheer size of the place, the service is polite and pleasant but impersonal. It is worth joining their free loyalty program just to get free upgraded wifi and there are other benefits as well. Also worth requesting a high floor.  The much vaunted roof top infinity pool is huge and the views are spectacular. It also has a child free section which is a great idea. That said, it is more of a…",4
