Comments,Ratings
"From lobby to room, the experience was breathtaking. The most wonderful feature of this hotel is definitely the Infinity Pool at the SkyPark. What could you say for a pool that located at the top of the 57th floor with a view overlooking Singapore Financial Center's skyline?",5
"Agree with other reviews about this iconic building with awsome views and pleasures to indulge in. However, all this is possible thanks to an army of some 10,000 working long hours and never tire doing their mundane work. It is therefore with appreciation to the management who plan and operate the logistics, but mainly to the staff who care for each and every one filing their 2500 rooms. Special mention to Paul in Spargo restaurant and Mr Qiu of houskeeping on 45th floor.",5
Excellent ambiance. Garden facing room was scenic. Infinity swimming pool was a place from where you never felt like moving. All restaurants had excellent and tasty food. The attached mall had its own charm. Superb service. Worth paying the price.   ,5
"Stayed here for a night as we wanted to check out the infinity pool. When we got to hotel there were no hotel staff to help us with luggage and in trying to manage our luggage and opening the door to the hotel lobby, I scraped the skin and part of my nail of my big toe. Not the best start to our stay. Upon checking in and letting staff know of the mishap they upgraded our room and sent up a first aid officer to look at my toe which was good customer service. The room they upgraded us to was spacious and had a wonderful view from the 42nd floor. Bathroom was huge. The infinity pool was amazing to say the least. The best time to be at the infinity pool is at sunset - just spectacular! Only thing is it can get crowded and eating at Marina Bay is very pricey!!! ",4
The hotel is an amazing architectural creation and is a must see if you are visiting Singapore. You ca either see it just from outside for free or pay entrance fees to go to the terrace garden of the hotel.,5
"My favourite hotel! Love it there. The pool and view are amazing. The club package was good value, would recommend. It included afternoon tea, drinks and canapés in the evening (all you can eat) and breakfast.",5
"Amazing hotel, rooms are to a high standard but its all about the roof top pool!!! The views are fantastic both during the day and night. The roof top bar and restaurant also fantastic with good food and excellent service.",5
We stayed there for one night as it was our birthdaypresent to my friend. We had a romm on the 37th floor with garden view which was amazing! Everyone did there best to make it a pleasant stay for us! And on top the view from the Pool was as amazing as we expected it. ,5
"We had a convention for our business and we stayed here for almost a week. I loved the view from our room, it was so beautiful and relaxing. The rooms were spacious, very comfortable and very clean. The pool was the best, I loved the view overlooking Singapore. I would love to come back here.",5
"Excellent Property, Excellent Service  No doubt, it's very expensive but, it's real Value for Money. Going to Singapore would not be complete if one doesn't stay here at least for two nights. It's roof top swimming pool on the 57th floor is one of the architectural marvels of the world.",5
"Ok, so some people had a few negative comments...but nothing comes close to MBS for the unique mile high experience, in every way! Staff who could not do enough to make our stay comfortable and enjoyable. Small room heating issue resolved efficiently. The Club Room Upgrade at 160SD worth every penny, and choose to stay as high as you can, we were on floor 53...check it out and spend out. Best rooms have to be the Club suite overlooking the City for stunning evening cityscape, Infinity pool on rooftop floor 60, I guess, is not unsafe at all, it's simply stunning to swim to the edge overlooking the city, with narrow terracing and safety barrier to prevent accidents. Club55 deal includes free drinks between 5pm and 7pm including good quality Champagne and canapés so good many…",5
"Who hasn't heard of the Marina Bay Sands.  This is a fantastic hotel to stay in. We booked this hotel for a few days to break up our 6 week trip onto Australia and Thailand.  When lining up to check in we were lead to the VIP check in just so we didn't have to wait. It's the attentiveness that makes a hotel a great hotel.  The hotel itself is very vast, with plenty of shops and restaurants to chose from even a train station below. Meaning lots of people pass through daily.  When you think of the Marina Bay Sands you think of the infinity pool at the very top overlooking Singapore. Luckily only reserved for guests staying at the hotel. Wow just wow, it can get busy up there with people waving selfie sticks but there is  plenty of loungers.  With a small number of restaurants for…",5
"The hotel is one of the best, the pool is amazing and worths the trip also offers a good set of discounts if you go shopping. The food is not bad is disgusting in every sense, disgusting and expensive it is so bad that after a few days my wife and me were longing for McDonalds.  The air conditioner in the room is pretty old so it never worked, when we asked them to fix it, the guy told us to get used to it. It is a massive hotel where nobody even tries to focus on the customer. We were going for our honeymoon told the concierge and front desk and we didn't get even a congratulations card. Finally, this is not a hotel but an amazing swimming pool that comes with a really lousy service. ",2
Rooms are spacious and the view is splendid. With shopping & dining galore it's practically a one stop paradise. Rooms facing the city had a nice night view but the rooms facing the sea had a better daytime view. I went with high expectations and MBS didn't disappoint.,4
"yes yes, so the biggest reason we stayed was to experience this pool... loved it...   also really enjoyed our family room. spacious room with views of the gardens by the bay. 1.5 baths, 1 king, 2 twins which are low for the kids, kitchenette, and living area, not to mention the terrace.  unfortunately we only stayed a night, but would come again as the family room has good value.  also cool that it's connected to the mall, so food choices are many. you won't run out of things to do here...",5
"This hotel totally blown my mind! It's pretty obvious that many people pick the hotel because of the view and the pool (which of course is a good reason it's totally mind blowing! Stunning view, amazing pool). Also worth mentioning is that the rooms are super nice, staff is really good and drinks are amazing. We really really enjoyed! ",5
"MBS is amazing, everything about it is fabulous. Staff are more than helpful, its spotlessly clean, my room was huge and very comfortable. The Sky Park was the selling point for me and I wasn't disappointed. Although I never ate in there, all of the Restaurants were well attended which speaks volumes. Travel writers say, Orchard Rd. is the place to shop in Singapore, no way, MBS, has it all. Personally, I can't fault MBS, see for yourself.",5
We were not supposed to stay here as the rooms charges were very expensive but one of my good friend who is together with us during this tour has strongly and forcefully recommended us that we have to stay there even if not suits our budget.  we have no choice but to accept his demand and we stayed there  Till that day we are thankful to him for a wonderful suggestion that he gave for choosing this hotel  The rooms were really big enough to satisfy you. Bathrooms were unbelievably big too. Have no words to say anything bad for this hotel.  Main and most important is the infinite pool on top of the hotel.   Had stayed there is like blessed.,5
"I have often wondered what it is like to be at the top of the Marina Bay Sands (MBS), the iconic building that every one admires from afar, and finally had an opportunity to stay in a Deluxe room last weekend.  Marina Bay Sands hotel has 3 towers - Towers 1, 2 and 3. The check-in counters are at Towers 1 and 3 and the check-in counter was crowded when we reached there. The check-in was orderly and efficient. We were given our key cards and a form where we could do a key-drop at the numerous Express check-out points at the ground floor when we check out. That would save us a lot of time when we check out.   As soon as we inserted our key card into the door, the curtains in our Deluxe room were drawn open automatically. Apparently, the curtains were programmed to close in an…",4
"We stayed in Marina Bay Sands in May 2015, so this review is slightly late. We booked a Deluxe Room to celebrate my dad's 60th birthday, and got upgraded to an Orchid Suite! The room was amazing! We had glass windows from the ceiling to the floor with views of the city and watched the Wonderfull Light Show from the room. The room was huge, with a sitting area and bathroom with separate shower and bath. We even had a view of Gardens by the Bay from the bathroom. The infinity pool had lovely views, but was really crowded. However, we still managed to get lounge chairs and our own private jacuzzi. There is a relatively small gym for the size of the property, and a sauna and hot pool with amazing views in the male and female toilets on the same floor as the gym. My parents were…",5
"Nothing I say about this hotel could do it justice for how amazingly incredible this hotel is. From the moment you arrive, you are treated with the utmost importance to the hotel and as a guest, the staff are there to do anything beyond their means to make your stay as memorable and unforgettable as possible. If you have only one chance to stay here at any time then I suggest you jump at the opportunity and run with it for what it's worth because I can guarantee you will not be disappointed.",5
"I arrived on 12th night and left totally disappointed on 15th afternoon.   First sight after a speedy check in was a long crowded corridor reminding you of Orchard Street on a busy Saturday which makes you wonder whether you have arrived at a five star hotel.  Moshe Safdie's architecture is what motivated me to come and I was not disappointed.   Rooms are well equipped with technologically advanced features and modern conveniences and not lacking in comfort. However, interior decor was boring.   According to in room information Ala Carte breakfast was available at the Restaurent Spago, but not so. Much against my wishes I had to be satisfied with buffet at Adrift and Rise. Surprisingly both charge the same rate but Adrift offers a shorter menu.  Complementary high speed wifi…",2
"There is no question that the Marina Bay Sands is a fantastic property, from its iconic table top swimming pool to the largest and highest end shopping mall on the planet, but if love is in the details they have missed some of the standards of customer service that one would expect from a modest hotel.  Some examples are that the hotel provides free internet to all guests, however it is nearly impossible to connect to and it is so slow it can take 5 minutes just to log on to a website.  The login process is supposed to be simple: room number followed by the 1st 3 letters of your last name.  No luck trying any combination.  I called guest services who said they'd get back to me with a solution and never heard from them.  Finally I got a generic code from the front desk but that…",3
"We stayed at the MBS for around 4 nights. From the moment you arrive you are exposed to nothing less than 5 star service from all of the staff. Everyone is helpful and willing to assist you at all times. Our room was lovely, with beautiful views of the Marina bay gardens and the ocean full of working ships. The Infinity rooftop pool is spectacular and is worth the money alone! You must get up before sunrise and watch it from the infinity pool! The skydeck is amazing at night. They hotel puts on a light and water show every evening which has a theme, its worth seeing. The gym facilities here are fantastic with pretty much a fully equipped gym, with adjoining male/female sauna, steamroom and hot pool. The gym staff are very welcoming, helpful and take the time to get to know you…",5
"This hotel was the highlight of our trip to the Orient.  After a 10 day cruise on the Queen Mary 2 from Hong Kong, we chose to stay at the Marina Bay Sands for two nights!  The pool was awesome and the staff were great!  I didn't want to leave the hotel as it was an all in one vacation by itself.  We stayed at the pool the first afternoon and then when we went back up at night it was a whole different experience as there is a club and two restaurants up there and the lights of the city are beautiful!",5
"This is the only hotel I have stayed in in the world where you pay extra to get 3 people in the room but the bed count doesn't increase. Thats right they sell on line a room for 3 adults for which you pay extra but the extra is only for the swimming pool access not a bed for the 3rd person. I couldn't believe that after paying $100 extra to upgrade from 2 - 3 people but I still needed to pay an extra $119 for a bed for the 3rd person? Also their executive club and pool access is only until checkout which is at 11am. If you are only staying one day don't bother running around to get the rewards deal as it takes 24-48 hours to load the 3% of your spend credit, if you do it though take your passport to the sign up desk. Service is terrible everyone gives differing info. The food at…",3
"I was there for business so decided to come in a few days early and I am so glad that I did.  I arranged for airport pickup which was comfortable and smooth.  I was greeted by name as soon as I got out of the car.  They took me directly to my room and checked me in there!  Talk about great service which only got better... A few minutes later I get a knock on the door - a special delivery of 6 delicious macarons!    Room - perfectly new, clean, roomy with a view of the bay, and patio doors that rolled all the way to the side for an unobstructed view along with a small terrace with roses.  I slept with the door open each night.  :)  Infinity pool - amazing like the photos depict. The drinks are expensive and the service is spotty (we ordered two drinks ahead to combat the slowness…",5
It's everything it was advertised to be. The skypark pool deck is awesome. Rooms in higher floors facing Gardens by the bay gives you a relaxing sight. Staff are all so accomodating especially the Filipinos. They can recognize fellow Filipinos right away and are very warm and pleasant.,5
we were lucky enough to get a stay in one of asias iconic hotels.The view from our bedroom looked over the city skyline and we were treated to a laser light show whilst laying in bed so why switch on the television!We explored the shops and casino and of course a dip in the infniti pool and a champagne breakfast in the morning to top it off.The staff were a1 and if you get the oppurtunity go for it as its an experiance to stay here no wonder David Beckham markets it.its extremely busy so allow some timefor booking ahead a date you require near the top of my hotel experiances!,5
"I have stayed for the fourth time last week in this hotel and just love this place. Each time I stay I find something new to do here and it is never over.  Great hotel, wonderful location, nice service, so much to do. One always feel like coming again and again.",5
"Had an overnight stay here last January with friends as they would want to go to Skypark and see the infamous infinity pool, up close. As I understand that this is a luxury 5 star hotel, it baffles me how the staff assigned at the pool area treats guests. Totally uncouth and not living to its hotel's 5 star rating. While we were in the pool and they were about to close already, we were surprised on how the staffs in the pool area used whistle to call people's attention that the pool is closing. And I'm not just talking about one whistle sound here!   And the high tea and breakfast at Rise, is a hit or miss.   As for the room, we got a nice one facing the bay area which my friends loved. No complains about the room I must say, but overall the management needs to brief their staff…",3
"Having previously visited Singapore and had a wander around Marina Bay Sands we were thrilled to actually stay there this time. This gave us access to the incredible rooftop infinity pool 58 storeys in the sky. We arrived at the hotel at 8.30am but were told we couldn't check in until 3.00pm. We explained we had flown in overnight and were tired and would like our room earlier and the receptionist said we will see what we can do. So we headed up to the pool and got a sun lounger and relaxed. At 11.00am we were told our room was ready. So we managed to get some sleep before exploring the amazing mall attached to the hotel and the waterfront. Breakfast was fantastic and the staff were incredibly courteous. Of course the hotel is vast with 2,500 rooms but it is a spectacle and the…",5
"Everything was perfect at this hotel. It's one of the more expensive hotels we've ever stayed in during our travels but it was absolutely worth the money. The room was very nice, spacious, clean, and well-kept. The rooftop infinity pool was truly breathtaking. The views of Singapore from the room was nice, but pales in comparison to the view on the rooftop. If you want some of the best cityscape pictures you'll take, take them here. Not a single bad thing to say about the hotel.   It is connected to one of the highest quality shopping areas you'll experience outside of Europe.   If you're touring Southeast Asia you know most other countries on your trip will be relatively inexpensive. Do like we did and spoil yourself for at least one night with this once in a lifetime…",5
"Booked this after seeing it being built on tv (mega constructions). We were on the 53rd floor and as you open the door to the room the curtains automatically open to reveal a breathtaking view of the city. The infinity pool on the top floor was worth the visit.  The hotel includes a huge shopping precinct restaurants, theatre and a casino for the general public also has access to the mtr system, unfortunately the reception is amongst this, for me it took away the whole 5 star experience, no personal touch at all. Rooms looked dated despite being a fairly new building. If I was going to Singapore again I would book somewhere in the same location but not this hotel. Location and easiness to get about was perfect though",4
We went for the grand prix so the price was even more expensive. The service was excellent and I dont really have any complaints. they room was fairly standard if a little small- im sure if you had a deluxe room or whatever it would have been better. What your really paying for is the use of the pool which i have to say was bloody fantastic! excellent views and great atomsphere especially at night.,4
"We booked a club room which included breakfast, afternoon tea, and canopies and drinks in the evening. The room was large with an equally large bathroom and shower room. The bed and pillows were really comfortable. The best part was the canopies and drinks each evening - just amazing, so much variety and high quality. The infinity pool was fantastic with the city as its backdrop - although it was always very crowded. I will stay here again if in Singapore.",5
"We visited this and stayed for 2 nights at the grand club city view room. This is a luxury high end hotel that is worth the splurge. The city view is by far more superior than the garden view - so worth the extra dollars if you are staying here. The club access which you get with club rooms is awesome and worth the money to upgrade as the food for breakfast, afternoon tea and drinks and canapés changes daily and is of high quality. The 57 floor offers great views of the Singapore skyline. The infinity pool - speaks for itself and worth going for sunset and sunrise as it offers beautiful views across Singapore.   Only negatives and why the score of 4. The hotel check in process was not smooth for us. The attitude of the person checking us in was appalling and there was a stuff up…",4
This is the second time I have stayed in the NBS and can say its a fantastic experience and a great hotel. we stayed in a club room and the club experience is great but a little inconvenient if you are not staying in tower 2 as the club room is only in this tower on the 55th floor. The room we had in tower 3 on level 19 was fantastic and large but believe they could do better with the shampoo etc..poor home brand offer. worth the money for the room size the view and the pool experience.,4
Nice hotel with nice staffs. On the first day at Singapore. I don't know how to get to the OCBC Arena. And Bellman escort me to the MRT station.  I loved the rooftop pool here.  Long Chim restaurant is the best place for Thai cuisine in MBS.,5
"The Marina Bay Sands is a luxurious hotel with service to match.  It has beautiful views, restaurants, pools, shops and staff to match.  Thank you to everyone at Marina Bay Sands for our lovely honeymoon stopover - we wish we could have stayed longer!",5
"Overpriced just for the pool experience.  No denial, view is spectacular. For the price, our room only provided a basic shower and a toilet. Check in after 3 p.m., check out 11 a.m. less than 24 hours so we booked two nights.    Our luggage took over one hour to be delivered to our room!!  And we had a 4 month old baby with urgent need to access his suitcase. The TV did not work for the first of the two nights we were there.  Had to phone to get it fixed.  The infinity pool was not as long as I had imagined it to be.  The sheer overcrowding takes away the pleasure....competition for a spot. I made the mistake of going in the evening, the pool  lighting  highlighted every possible piece of solid matter floating around from the overwhelming number of humans who visited that day. …",2
"Best hotel I've ever stayed in! Excellent service, spacious rooms, nice food, amazing city view, stunning infinity pool, hot tubs, bars, restaurants, etc. All you need. Definitely a must-place to stay in Singapore!  You must experience the luxurious Marina Bay Sands Hotel and all it has to offer, otherwise you have not been to Singapore ;)",5
"Marina bay.   Beautiful. Arrived on 4th April in time to celebrate my birthday on the 5th after spending a week in Malaysia. Absolutely astounded with Singapore as a whole but the hotel was out of this world. Large with amazing architectural features and a lovely 57th floor pool with multiple bars. As the place is so busy, check in anytime before 3pm is pretty much impossible but we sat on the patio by the sky restaurant and had a lovely lunch while waiting . Helpful staff, amazing restaurants and bars, worth every penny. Will definitely be back",5
"Big hotel with complete amenities; many food options, entertainment and high end retail shops. Can easily occupy a day there. Rooms are of decent size and comfortable. The infinity pool at roof top offers great view of city... really awesome! ",4
"We spent two nights at the Marina Bay Sands, along with a couple of friends.  We picked the hotel because of the pool, which is truly spectacular, with a view out over Singapore.  That said, it gets crowded, really crowded, so you need to get out there early to secure a spot.  The view is worth the effort.  All in all it felt like a very nice Las Vegas property, but the hotel is a little off by itself.  Cabs are plentiful.",4
"We splurged for a suite and it was amazing! We had a view of the gardens from our balcony and a view of the city from our bathtub. The design of the room was luxurious and simple.  So many non-guests attempt to get to the rooftop infinity pool so you feel pretty VIP when you are able to swipe in wth your key card.  Another perk to getting the suite is that you get complimentary drinks at happy hour and breakfast in the morning in the lounge. I had a particularly pleasant interaction with Flourish. She was so sweet and interested in learning about my time in Singapore.  Even if you can only afford one night here, I recommend it just for the experience.",5
"We stayed here in 2014 and it was simply amazing. We were upgraded to an even larger suite which took up the entire end of one of the towers. After requesting a room with views of the bay, we were treated to wall-to-wall views of the bay. From the bathroom we enjoyed wall-to-wall views of the ocean and Gardens By The Bay (the light displays are stunning, even from the bath). Every stay is not complete without a visit the rooftop infinity pool. Will definitely return again!!!",5
"The best hotel of Singapore. The architecture, the room size, the pool, The service. Beauty of the hotel is its infinity pool on 57th floor. Hotel guest have free entry. Nice seen of entire Singapore and with all safety precautions are taken.",5
"A great hotel, Amazing amenities, great pool, shopping, wonderful rooms, great outlook but just too big. too impersonal and most guests are there for a day or two. At times you get the feeling you are in Singapore Airport! Great to experience at least once in your life. Checkout, Checkin is easy, and everything works - just gave it four stars due to its size and movement of people!",4
It's a shame you can't pay an entrance fee to get into the infinity pool without staying there .... We tried to book and they where full ..   The infinity pool and universal studios was the only reason we where going to Singapore ...    But we could not get into the pool .... Also it is rediculously expensive ...    We had one drink (Not each just 1 ) and a coffee     cost 50$ with tip ....        ,3
